{
  "arithmetic_state": {
    "analytic_norm": "L2_PHASE_MAXIMAL_BC",
    "endpoint_quantifier": "ALL_PREFIX_THETA_SHELL",
    "metric_to_uncontrolled_atom_route": "STOP_SCOPED",
    "named_fixed_atom": false,
    "phase_quantifier": "LEBESGUE_AE_FIXED_PHASE",
    "pointwise_fixed_atom_routes": "OPEN",
    "production_phase_registry": false,
    "program_positive_L2": false,
    "strongest_export": "A170.metric_packet_corridor",
    "strongest_level": "L1_ACTUAL_CORE_PHASE_METRIC_PACKET_CORRIDOR"
  },
  "claim_boundary": {
    "Lebesgue_ae_covers_production_phase": false,
    "architecture_route_universe_complete": false,
    "archive_address_is_occurrence_identity": false,
    "arithmetic_subroute_is_architecture_reroute": false,
    "formal_gluing_is_actual_totality": false,
    "formal_support_is_actual_active_support": false,
    "metric_all_prefix_is_deterministic_physical_endpoint": false,
    "phase_average_is_named_fixed_atom": false,
    "prime_pair_lower_bound": false,
    "program_positive_L2": false,
    "registry_density_identifies_distinguished_phase": false,
    "source_hashes_prove_theorems": false,
    "strict_one_over_400": false,
    "twin_prime_theorem": false,
    "zero_frozen_edges_mean_actual_edges_do_not_exist": false
  },
  "current_verdict": "NOT_TESTABLE",
  "endpoint_ledger_v4": {
    "arithmetic": {
      "named_fixed_atom_sigma": {
        "denominator": 1,
        "numerator": 0
      },
      "phase_metric_sigma": "every delta<1/4",
      "phase_metric_sigma_scope": "LEBESGUE_AE_EXPLICIT_PACKET_SCHEDULE",
      "sigma_required": {
        "denominator": 400,
        "numerator": 1
      },
      "state": "PHASE_METRIC_ONLY"
    },
    "charge_registry": [
      {
        "charge_id": "ARITH.phase_metric_power",
        "eligible_for_named_fixed_atom": false,
        "owner": "arithmetic",
        "quantity_kind": "FIXED_X_POWER_PHASE_METRIC",
        "source_export": "A170.metric_packet_corridor",
        "state": "PROVED",
        "value": "every delta<1/4 on the explicit packet schedule"
      },
      {
        "charge_id": "ARITH.packet_union",
        "eligible_for_named_fixed_atom": false,
        "owner": "arithmetic",
        "quantity_kind": "POLYLOG_PACKET_UNION_COST",
        "source_export": "A170.metric_packet_corridor",
        "state": "PROVED_PAID",
        "value": "included in the Borel-Cantelli summability condition"
      },
      {
        "charge_id": "PHYS.phase_atom_crosswalk",
        "eligible_for_named_fixed_atom": false,
        "owner": "physical",
        "quantity_kind": "METRIC_TO_NAMED_ATOM_COST",
        "source_export": null,
        "state": "NOT_TESTABLE",
        "value": null
      },
      {
        "charge_id": "PHYS.literal_weight",
        "eligible_for_named_fixed_atom": false,
        "owner": "physical",
        "quantity_kind": "LITERAL_WEIGHT_COST",
        "source_export": null,
        "state": "NOT_TESTABLE",
        "value": null
      },
      {
        "charge_id": "PHYS.endpoint",
        "eligible_for_named_fixed_atom": false,
        "owner": "physical",
        "quantity_kind": "DETERMINISTIC_ENDPOINT_COST",
        "source_export": null,
        "state": "NOT_TESTABLE",
        "value": null
      },
      {
        "charge_id": "PHYS.four_sign_reconnection",
        "eligible_for_named_fixed_atom": false,
        "owner": "physical",
        "quantity_kind": "RECONNECTION_COST",
        "source_export": null,
        "state": "NOT_TESTABLE",
        "value": null
      }
    ],
    "contract": "MVP7_FIXED_H0_NON_DUPLICATING_ENDPOINT_V4",
    "endpoint_mode": {
      "proved": "ALL_PREFIX_THETA_SHELL_IN_PHASE_METRIC",
      "required": "DETERMINISTIC_ALL_PREFIX_AT_NAMED_FIXED_ATOM"
    },
    "full_synthesis": {
      "one_over_400_paid": false,
      "scope_compatible": false,
      "state": "INCOMPLETE",
      "strict_net_slack": null
    },
    "invariants": {
      "charge_ids_unique": true,
      "each_charge_has_one_owner": true,
      "full_synthesis_references_not_recharges": true,
      "metric_power_not_charged_as_named_atom_power": true,
      "unknown_is_not_zero": true
    },
    "literal_gate": {
      "actual_active_support": "NOT_TESTABLE",
      "canonical_or_minimal_representation": "NOT_TESTABLE",
      "fixed_physical_h0": "PROVED",
      "literal_physical_coefficients": "NOT_TESTABLE",
      "physical_atomic_normalization": "NOT_TESTABLE",
      "strict_one_over_400_budget": "NOT_TESTABLE"
    },
    "phase_mode": {
      "atom_concentration_bound": null,
      "fixed_atom_crosswalk": "NOT_TESTABLE",
      "proved": "LEBESGUE_AE_FIXED_PHASE",
      "required": "NAMED_FIXED_ATOM",
      "separation_bound": null
    },
    "physical": {
      "lambda_upper": null,
      "registry_complete": false,
      "state": "NOT_TESTABLE"
    },
    "registry_gate": {
      "active_support_certificate": "NOT_TESTABLE",
      "canonical_minimal_representation_certificate": "NOT_TESTABLE",
      "endpoint_registry": "NOT_TESTABLE",
      "literal_weight_registry": "NOT_TESTABLE",
      "normalization_registry": "NOT_TESTABLE",
      "occurrence_registry": "NOT_TESTABLE",
      "phase_registry": "NOT_TESTABLE",
      "source_backed_local_occurrence_edge_family": "NOT_TESTABLE"
    },
    "scale": "AMPLITUDE"
  },
  "first_missing": {
    "minimal_not_testable_nodes": [
      "H1.source_backed_local_occurrence_edge_family",
      "H1.actual_active_support_certificate",
      "H1.canonical_minimal_representation_certificate",
      "H9.literal_weight_registry",
      "H9.phase_cell_registry",
      "H9.endpoint_registry",
      "H9.normalization_registry"
    ],
    "node_id": "H1.source_backed_local_occurrence_edge_family",
    "selected_route": "occurrence_augmented_map",
    "selection_rule": "SELECTED_ARCHITECTURE_ROOT_THEN_MINIMAL_MISSING_ANCESTOR_THEN_DECLARED_OBLIGATION_ORDER_THEN_NODE_ID",
    "status": "NOT_TESTABLE"
  },
  "h9_arithmetic_firewall": {
    "arithmetic_ancestor_ids": [],
    "firewall_pass": true,
    "policy": "H9_MUST_HAVE_NO_DIRECT_OR_TRANSITIVE_ARITHMETIC_ANCESTOR",
    "root_node": "H9.physical_registry",
    "transitive_ancestor_ids": [
      "D166.crosswalk_factor_contract",
      "H1.actual_active_support_certificate",
      "H1.actual_occurrence_lift",
      "H1.canonical_minimal_representation_certificate",
      "H1.occurrence_registry_totality",
      "H1.source_backed_local_occurrence_edge_family",
      "H9.endpoint_registry",
      "H9.literal_weight_registry",
      "H9.normalization_registry",
      "H9.phase_cell_registry",
      "S163.source_edge_census",
      "S164.minimal_archive_address",
      "S165.formal_local_gluing"
    ]
  },
  "imports": [
    {
      "artifact_id": "artifact.frozen_source_census",
      "artifact_readiness": "READY",
      "carrier_id": "carrier.frozen_cut_archive",
      "evidence_level": "L0_SOURCE_CENSUS_SCOPED",
      "export_id": "S163.frozen_source_edge_census",
      "normalization_id": "norm.physical_atomic",
      "paper": "TPC-163",
      "promotion_eligible": false,
      "quantifier_signature": {
        "carrier_axis": "FROZEN_ARCHIVE",
        "decay_axis": "SCHEMA_ONLY",
        "endpoint_axis": "NOT_APPLICABLE",
        "phase_axis": "NOT_APPLICABLE",
        "scale_axis": "FROZEN_FINITE_PACKET",
        "support_axis": "FORMAL_ARCHIVE"
      },
      "scope_id": "scope.frozen_declared_corpus",
      "status": "PROVED"
    },
    {
      "artifact_id": "artifact.minimal_archive_key",
      "artifact_readiness": "READY",
      "carrier_id": "carrier.frozen_cut_archive",
      "evidence_level": "L0_ARCHIVE_ADDRESSING",
      "export_id": "S164.unique_minimal_archive_address",
      "normalization_id": "norm.physical_atomic",
      "paper": "TPC-164",
      "promotion_eligible": false,
      "quantifier_signature": {
        "carrier_axis": "FROZEN_ARCHIVE",
        "decay_axis": "SCHEMA_ONLY",
        "endpoint_axis": "NOT_APPLICABLE",
        "phase_axis": "NOT_APPLICABLE",
        "scale_axis": "FROZEN_FINITE_PACKET",
        "support_axis": "FORMAL_ARCHIVE"
      },
      "scope_id": "scope.frozen_archive_addressing",
      "status": "PROVED"
    },
    {
      "artifact_id": "artifact.formal_local_gluing",
      "artifact_readiness": "READY",
      "carrier_id": "carrier.formal_local_families",
      "evidence_level": "L0_FORMAL_LOCAL_GLUING",
      "export_id": "S165.compatible_local_family_gluing",
      "normalization_id": "norm.physical_atomic",
      "paper": "TPC-165",
      "promotion_eligible": false,
      "quantifier_signature": {
        "carrier_axis": "FORMAL_LOCAL_FAMILIES",
        "decay_axis": "SCHEMA_ONLY",
        "endpoint_axis": "NOT_APPLICABLE",
        "phase_axis": "NOT_APPLICABLE",
        "scale_axis": "FROZEN_FINITE_PACKET",
        "support_axis": "FORMAL_LOCAL_FAMILY"
      },
      "scope_id": "scope.formal_compatible_local_families",
      "status": "PROVED"
    },
    {
      "artifact_id": "artifact.three_factor_crosswalk_contract",
      "artifact_readiness": "READY",
      "carrier_id": "carrier.all_nonsoft_cut_paths",
      "evidence_level": "L1_STRUCTURAL_DECISION",
      "export_id": "D166.three_factor_crosswalk_contract",
      "normalization_id": "norm.physical_atomic",
      "paper": "TPC-166",
      "promotion_eligible": false,
      "quantifier_signature": {
        "carrier_axis": "FROZEN_ARCHIVE",
        "decay_axis": "SCHEMA_ONLY",
        "endpoint_axis": "NOT_APPLICABLE",
        "phase_axis": "NOT_APPLICABLE",
        "scale_axis": "FROZEN_FINITE_PACKET",
        "support_axis": "FORMAL_ARCHIVE"
      },
      "scope_id": "scope.actual_occurrence_augmented_route",
      "status": "PROVED"
    },
    {
      "artifact_id": "artifact.phase_parseval",
      "artifact_readiness": "READY",
      "carrier_id": "carrier.determinant_two_actual_core",
      "evidence_level": "L1_ACTUAL_CORE_PHASE_METRIC_SINGLE_CELL",
      "export_id": "A167.direct_additive_twist_phase_L2",